<?xml version="1.0" encoding="UTF-8"?>
<SAG:VendorResponse xmlns:SAG="http://softwareassuranceguardian.com/" xmlns:xsi="http://www.w3.org/2001/XMLSchema-instance" xsi:schemaLocation="http://softwareassuranceguardian.com/ SAGVendorSchema.xsd ">
  <SAG:VendorLegalName>Reliable Energy Analytics LLC</SAG:VendorLegalName>
  <SAG:SupplierID>dns:reliableenergyanalytics.com</SAG:SupplierID>
  <SAG:StreetAddress>23 Linda Drive</SAG:StreetAddress>
  <SAG:City>Westfield</SAG:City>
  <SAG:StateOrProvince>Massachusetts</SAG:StateOrProvince>
  <SAG:ZipCode>01085</SAG:ZipCode>
  <SAG:Country>USA</SAG:Country>
  <SAG:WebsiteURL>https://reliableenergyanalytics.com/</SAG:WebsiteURL>
  <SAG:ContactTelephone>978-696-1788</SAG:ContactTelephone>
  <SAG:ContactEmail>dick@reliableenergyanalytics.com</SAG:ContactEmail>
  <SAG:ContactPerson>Dick Brooks</SAG:ContactPerson>
  <SAG:DUNSNumber>REDACTED</SAG:DUNSNumber>
  <SAG:NAESBEIRID>REAL</SAG:NAESBEIRID>
  <SAG:CyberSecPolicyURL>https://softwareassuranceguardian.com/REDACTED</SAG:CyberSecPolicyURL>
  <SAG:FinancialDataURL>https://softwareassuranceguardian.com/REDACTED</SAG:FinancialDataURL>
  <SAG:CompanyDataURL>https://softwareassuranceguardian.com/REDACTED</SAG:CompanyDataURL>
  <SAG:Products>
    <SAG:Product>
      <SAG:LicensorName>Reliable Energy Analytics LLC</SAG:LicensorName>
      <SAG:ProductName>SAG-PM (TM)</SAG:ProductName>
      <SAG:Version>1.1.3</SAG:Version>
      <SAG:SBOM type="cycloneDX" version="1.2" format="XML" signature="https://softwareassuranceguardian.com/REDACTED">https://softwareassuranceguardian.com/REDACTED</SAG:SBOM>
      <SAG:SourceLocationURL>https://softwareassuranceguardian.com/REDACTED/REDACTED/</SAG:SourceLocationURL>
      <SAG:DigitallySigned>Y</SAG:DigitallySigned>
      <SAG:UnsolvedVulnerabilities>N</SAG:UnsolvedVulnerabilities>
      <SAG:SDLCPolicyURL>https://softwareassuranceguardian.com/REDACTED</SAG:SDLCPolicyURL>
      <SAG:SDLCEvidenceDataURL>https://softwareassuranceguardian.com/REDACTED</SAG:SDLCEvidenceDataURL>
      <SAG:CommercialStatus>Available</SAG:CommercialStatus>
      <SAG:SupportStatus>Supported</SAG:SupportStatus>
      <SAG:LastModifiedDateTimeUTC>2021-09-28T17:34:00</SAG:LastModifiedDateTimeUTC>
    </SAG:Product>
  </SAG:Products>
</SAG:VendorResponse>
