<?xml version="1.0" encoding="UTF-8"?>
<!-- 
	Copyright and all other rights reserved by Reliable Energy Analytics, LLC (REA) 2018-2022. 
DISCLAIMER OF WARRANTIES
TO THE EXTENT NOT PROHIBITED BY LAW, REA HEREBY DISCLAIMS ALL EXPRESS OR IMPLIED REPRESENTATIONS, 
WARRANTIES, GUARANTEES, AND CONDITIONS OF ANY KIND, ARISING BY LAW OR OTHERWISE, WITH REGARD TO THIS ARTIFACT, 
INCLUDING BUT NOT LIMITED TO REPRESENTATIONS, WARRANTIES, GUARANTEES, AND CONDITIONS OF MERCHANTABILITY, 
FITNESS FOR A PARTICULAR PURPOSE, TITLE, NONINFRINGEMENT, AND QUALITY OF SERVICE.
 
REA MAKES NO REPRESENTATIONS OR WARRANTIES REGARDING THE CONTENT, EFFECTIVENESS, USEFULNESS, RELIABILITY, 
AVAILABILITY, TIMELINESS, QUALITY, SUITABILITY, ACCURACY OR COMPLETENESS OF THIS ARTIFACT OR THE 
RESULTS YOU MAY OBTAIN BY USING THE ARTIFACT OR THAT THE ARTIFACT WILL BE ERROR-FREE.
	
--> 
<SAG:VendorResponse xmlns:SAG="http://softwareassuranceguardian.com/" xmlns:xsi="http://www.w3.org/2001/XMLSchema-instance" xsi:schemaLocation="http://softwareassuranceguardian.com/ SAGVendorSchema.xsd ">
  <SAG:VendorLegalName>Reliable Energy Analytics LLC</SAG:VendorLegalName>
  <SAG:SupplierID>dns:reliableenergyanalytics.com</SAG:SupplierID>
  <SAG:StreetAddress>23 Linda Drive</SAG:StreetAddress>
  <SAG:City>Westfield</SAG:City>
  <SAG:StateOrProvince>Massachusetts</SAG:StateOrProvince>
  <SAG:ZipCode>01085</SAG:ZipCode>
  <SAG:Country>USA</SAG:Country>
  <SAG:WebsiteURL>https://reliableenergyanalytics.com/</SAG:WebsiteURL>
  <SAG:ContactTelephone>978-696-1788</SAG:ContactTelephone>
  <SAG:ContactEmail>dick@reliableenergyanalytics.com</SAG:ContactEmail>
  <SAG:ContactPerson>Dick Brooks</SAG:ContactPerson>
  <SAG:DUNSNumber>111509681</SAG:DUNSNumber>
  <SAG:NAESBEIRID>REAL</SAG:NAESBEIRID>
  <SAG:CyberSecPolicyURL>https://softwareassuranceguardian.com/CyberSecPolicy.html</SAG:CyberSecPolicyURL>
  <SAG:FinancialDataURL>https://softwareassuranceguardian.com/FinancialData.html</SAG:FinancialDataURL>
  <SAG:CompanyDataURL>https://softwareassuranceguardian.com/CompanyData.html</SAG:CompanyDataURL>
  <SAG:Products>
    <SAG:Product>
      <SAG:LicensorName>Reliable Energy Analytics LLC</SAG:LicensorName>
      <SAG:ProductName>SAG-PM (TM)</SAG:ProductName>
      <SAG:Version>1.2</SAG:Version>
      <SAG:SBOM type="cycloneDX" version="1.4" format="XML" DigitalSignatureURL="https://softwareassuranceguardian.com/SAG-PM_SBOM_V1_2.xml.sig">https://softwareassuranceguardian.com/SAG-PM_SBOM_V1_2.xml</SAG:SBOM>
      <SAG:SourceLocationURL>https://softwareassuranceguardian.com/sag-pm.zip</SAG:SourceLocationURL>
      <SAG:DigitallySigned>Y</SAG:DigitallySigned>
      <SAG:UnsolvedVulnerabilities>N</SAG:UnsolvedVulnerabilities>
      <SAG:KnownVulnInfoURL DocFormat="XML" DigitalSignatureURL="https://softwareassuranceguardian.com/SAG-PM_VulnDisclosure_V1_2.xml.sig">https://softwareassuranceguardian.com/SAG-PM_VulnDisclosure_V1_2.xml</SAG:KnownVulnInfoURL>
      <SAG:SDLCPolicyURL>https://softwareassuranceguardian.com/SAG-PM-V1_2_SDLC-POLICY-NIST.SP.800-218.SSDF-table.pdf</SAG:SDLCPolicyURL>
      <SAG:SDLCEvidenceDataURL>https://softwareassuranceguardian.com/SAG-PM_SDLCEvidenceData_V1_2.html</SAG:SDLCEvidenceDataURL>
	  <SAG:CyberSecLabelURL>https://softwareassuranceguardian.com/SAGCTR_inquiry/getSAGScore?FileHash=94EDB27E1995370E9003EE0A0A12D0A7DE2E8DA5EB663C31A97CB4215AB171B6</SAG:CyberSecLabelURL>
      <SAG:CommercialStatus>Available</SAG:CommercialStatus>
      <SAG:SupportStatus>Supported</SAG:SupportStatus>
      <SAG:LastModifiedDateTimeUTC>2022-09-22T16:23:00</SAG:LastModifiedDateTimeUTC>
    </SAG:Product>
  </SAG:Products>
</SAG:VendorResponse>

